{
  "$schema": "https://json-schema.org/draft/2020-12/schema",
  "$id": "https://my-dashboards.local/schemas/preset.schema.json",
  "title": "UI preset manifest",
  "type": "object",
  "additionalProperties": false,
  "required": [
    "schemaVersion",
    "kind",
    "id",
    "name",
    "level",
    "mappings",
    "supportedThemes"
  ],
  "properties": {
    "schemaVersion": {
      "const": 1
    },
    "kind": {
      "const": "preset"
    },
    "id": {
      "$ref": "common.schema.json#/$defs/id"
    },
    "name": {
      "type": "string",
      "minLength": 1
    },
    "description": {
      "type": "string"
    },
    "level": {
      "$ref": "common.schema.json#/$defs/lifecycle"
    },
    "collection": {
      "$ref": "common.schema.json#/$defs/reference"
    },
    "ownerArtifact": {
      "$ref": "common.schema.json#/$defs/reference"
    },
    "mappings": {
      "type": "object",
      "additionalProperties": false,
      "required": [
        "layout",
        "components",
        "primitives"
      ],
      "properties": {
        "layout": {
          "$ref": "common.schema.json#/$defs/reference"
        },
        "components": {
          "$ref": "common.schema.json#/$defs/stringMap"
        },
        "primitives": {
          "$ref": "common.schema.json#/$defs/stringMap"
        },
        "assets": {
          "$ref": "common.schema.json#/$defs/stringMap"
        }
      }
    },
    "supportedThemes": {
      "type": "array",
      "uniqueItems": true,
      "items": {
        "$ref": "common.schema.json#/$defs/reference"
      }
    }
  }
}
